product_id,product_name,brand,claim_text,context,is_claim,claim_verifiable,claim_conflict,conflict_explanation
3245550078681,Snack poppé T&H,Too GoodFrance,Afdiag,Snack poppé T&H | Too GoodFrance,1,0,0,gluten-related certification/logo
3229820787985,Crème de coco légère,BJORG,30% less fat,Crème de coco légère | BJORG,1,1,0,30% less fat claim
8718114724430,Light Mayonnaise,Hellman's,Omega-3,Light Mayonnaise | Hellman's,1,0,1,omega-3 nutrient claim
20561338,coconut milk,"Freshona, Lidl, Vitasia",Malo ili bez masti,"coconut milk | Freshona, Lidl, Vitasia",1,1,0,low or very low fat claim
20103354,Reduced Fat Soft Cheese,"Milbona,Lidl",Com pouca ou sem gordura,"Reduced Fat Soft Cheese | Milbona,Lidl",1,1,0,low or very low fat claim
3073781081909,Mini light,Babybel,Pasteurized,Mini light | Babybel,1,0,0,pasteurized milk processing claim
3073780828642,Minibaby light,Babybel,Dairy Farmers of Canada Quality Milk,Minibaby light | Babybel,1,0,0,quality milk certification/logo
5026489483030,Hummus chips tomato and basil,Eat Real,Kashrut division of the London Beth Din,Hummus chips tomato and basil | Eat Real,1,0,0,kosher certification claim
612322000028,Stem Ginger Oat Biscuit Breaks,Nairn's,40% less sugar,Stem Ginger Oat Biscuit Breaks | Nairn's,1,1,0,40% less sugar claim
8720182592132,LIGHT MAYONNAISE,HELLMANN'S,65% less fat,LIGHT MAYONNAISE | HELLMANN'S,1,1,0,65% less fat claim